{
  "schemaVersion": 1,
  "sourceFormat": "gettext_po",
  "locale": "en-US",
  "messages": {
    "Quiet bay": {
      "defaultMessage": "Port calme",
      "metadata": {
        "sourceMessage": "Quiet bay",
        "gettextDomain": " north",
        "gettextDomainHeader": {
          "locale": "en-US"
        }
      }
    }
  }
}
