{
  "schemaVersion": 1,
  "sourceFormat": "android",
  "locale": "en",
  "messages": {
    "route": {
      "defaultMessage": "Waypoint",
      "metadata": {
        "androidResourcePath": "res/values-en-131071x65536/strings.xml",
        "androidResourceQualifiers": [
          "en",
          "131071x65536"
        ]
      }
    }
  }
}
